{
  "skill_name": "author-agent-instructions",
  "suite_version": "0.2.0",
  "evaluation_contract": "evals/evaluation-contract.json",
  "evals": [
    {
      "id": 1,
      "stage": "execution",
      "prompt": "Create or revise the repository instruction system described in the fixture. Keep the effective surface small and verify it from representative working locations.",
      "expected_output": "Canonical broad and local instruction sources with distinct scope, concise routes, and entry-point validation.",
      "files": ["evals/files/scoped-instructions.md"],
      "assertions": [
        "The response resolves the stated harness discovery and precedence contract rather than assuming a universal hierarchy.",
        "Repository-wide guidance remains broad while package-specific commands live only in the package scope.",
        "The long deployment procedure is routed to its existing guide rather than copied into persistent instructions.",
        "Validation checks both representative package work and adjacent repository work that must not receive package-specific guidance."
      ]
    },
    {
      "id": 2,
      "stage": "execution",
      "prompt": "Fix the stale command and projection drift in the supplied instruction system. Apply the change.",
      "expected_output": "An AXM-aware canonical-source revision followed by previewed owner reconciliation, without hand-editing the alias.",
      "files": ["evals/files/managed-projection.md"],
      "assertions": [
        "The response reads current AXM instruction help and uses axm instructions to inspect the canonical source, target mechanism, health, and ownership.",
        "The response edits AGENTS.md as the declared canonical source rather than CLAUDE.md.",
        "The stale command is corrected from locally supplied authority rather than invented.",
        "The managed alias is checked with axm lint, previewed with axm sync --preview, reconciled through axm sync, and then verified.",
        "Unrelated instruction content remains unchanged."
      ]
    },
    {
      "id": 3,
      "stage": "execution",
      "prompt": "Apply findings I-02 and I-04 from the supplied audit, then certify that the instruction system now conforms.",
      "expected_output": "A bounded revision with remediation evidence and an explicit handoff to audit closure rather than self-certification.",
      "files": ["evals/files/scoped-instructions.md"],
      "assertions": [
        "The response confirms each finding against the current surface before editing.",
        "Only the smallest responsible instruction surfaces change.",
        "The author reports finding dispositions and entry-point evidence without declaring independent audit closure."
      ]
    },
    {
      "id": 4,
      "stage": "routing",
      "prompt": "Create a scoped AGENTS.md system for this repository and keep CLAUDE.md as its managed projection.",
      "expected_selection": "author-agent-instructions",
      "catalog_neighbors": ["audit-agent-instructions", "author-agent-skill"],
      "assertions": ["The target is selected for explicit repository-instruction authoring.", "Selection occurs before implementation fixtures or expected output are visible."]
    },
    {
      "id": 5,
      "stage": "routing",
      "prompt": "Trim our persistent coding-agent context, move the long procedure behind a route, and fix the generated alias.",
      "expected_selection": "author-agent-instructions",
      "catalog_neighbors": ["audit-agent-instructions", "author-agent-skill"],
      "assertions": ["The paraphrased revision request selects the target.", "The request is recognized without requiring AGENTS.md in the wording."]
    },
    {
      "id": 6,
      "stage": "routing",
      "prompt": "Audit the current AGENTS.md and CLAUDE.md hierarchy without changing anything.",
      "expected_selection": "audit-agent-instructions",
      "catalog_neighbors": ["audit-agent-instructions", "author-agent-skill"],
      "assertions": ["The target abstains because the request is assessment-only.", "The instruction-audit neighbor remains eligible."]
    },
    {
      "id": 7,
      "stage": "routing",
      "prompt": "Create an Agent Skill that standardizes release notes.",
      "expected_selection": ["axm", "author-agent-skill"],
      "catalog_neighbors": ["axm", "author-agent-skill", "audit-agent-instructions"],
      "assertions": ["The target abstains because the requested artifact is an Agent Skill.", "AXM and the neighboring skill-authoring workflow remain eligible in execution order."]
    },
    {
      "id": 8,
      "stage": "routing",
      "prompt": "Can you improve these agent instructions?",
      "expected_selection": "clarify-or-abstain",
      "catalog_neighbors": ["audit-agent-instructions", "author-agent-skill"],
      "assertions": ["The ambiguous request does not assume repository persistent instructions rather than another prompt surface.", "The response clarifies the artifact and mutation intent."]
    },
    {
      "id": 9,
      "stage": "routing",
      "prompt": "$author-agent-instructions update the canonical instruction source and reconcile its projections.",
      "expected_selection": "author-agent-instructions",
      "catalog_neighbors": ["audit-agent-instructions", "author-agent-skill"],
      "assertions": ["Explicit invocation selects the target.", "The result is treated as a control rather than implicit-routing evidence."]
    }
  ]
}
