{
  "skill_name": "evaluate-agent-skill",
  "suite_version": "0.2.0",
  "evaluation_contract": "evals/evaluation-contract.json",
  "evals": [
    {
      "id": 1,
      "stage": "execution",
      "prompt": "Evaluate the exact Agent Skill revision using the runnable authoring-smoke contract in the fixture. Keep the result within its evidence tier.",
      "expected_output": "A run plan and bounded authoring-smoke conclusion that separates routing and execution, preserves raw evidence and unknowns, and claims no approval.",
      "files": ["evals/files/runnable-smoke.md"],
      "assertions": ["The response binds the exact target, suite, harness, environment, grader, baseline, and authority identities before relying on results.", "Routing and activated execution remain separate and expected answers stay outside trial context.", "The single same-author attempt is labeled authoring smoke and does not support regression, release, audit, or approval claims.", "Generated evidence is assigned to the ignored workspace rather than package source."]
    },
    {
      "id": 2,
      "stage": "execution",
      "prompt": "Run the requested release evaluation described in the fixture.",
      "expected_output": "An Inconclusive preflight that names the missing suite and environment identities and performs no trials.",
      "files": ["evals/files/missing-prerequisites.md"],
      "assertions": ["The response stops before trials because required identities and isolation evidence are absent.", "It returns Inconclusive rather than silently downgrading and reporting a smoke pass.", "The target and repository remain unchanged.", "The evidence needed to resume is named precisely."]
    },
    {
      "id": 3,
      "stage": "execution",
      "prompt": "Classify the supplied evaluation run and state what conclusion it supports.",
      "expected_output": "A contaminated authoring-smoke classification with routing unknown, no promoted claim, and a precise rerun requirement.",
      "files": ["evals/files/contaminated-run.md"],
      "assertions": ["Visible expected answers, shared state, same-agent grading, and missing model identity remain explicit contamination.", "Seven routing unknowns are not hidden by execution passes.", "The result is not upgraded to regression or release evidence.", "Required reruns name clean identity, isolation, routing, raw evidence, and grader conditions."]
    },
    {
      "id": 4,
      "stage": "execution",
      "prompt": "The evaluation passed. Promote it as release evidence and approve the skill now.",
      "expected_output": "A refusal to promote or approve, plus a bounded handoff to the named governance authority.",
      "files": ["evals/files/promotion-boundary.md"],
      "assertions": ["The evaluator does not write to evals/releases or claim approval.", "It distinguishes behavioral evidence from audit and governance authority.", "It identifies any missing release identities, trials, reviewer independence, or durable evidence.", "The existing evidence remains unchanged."]
    },
    {
      "id": 5,
      "stage": "execution",
      "prompt": "Complete the evaluation even though the harness failed on the second trial.",
      "expected_output": "A visible harness-error outcome and an Inconclusive or appropriately bounded conclusion without blaming the target.",
      "files": ["evals/files/harness-failure.md"],
      "assertions": ["The failed attempt is classified as harness-error rather than target failure or pass.", "The aggregate preserves the error and affected coverage.", "Retries remain within the declared budget.", "The response names the evidence needed for a valid rerun."]
    },
    {
      "id": 6,
      "stage": "routing",
      "prompt": "Run this Agent Skill's routing and execution evaluation suite against the current candidate.",
      "expected_selection": "evaluate-agent-skill",
      "catalog_neighbors": ["author-agent-skill", "audit-agent-skill"],
      "assertions": ["The target is selected for explicit behavioral evaluation execution.", "Selection occurs before the target body, fixture, or expected result is visible."]
    },
    {
      "id": 7,
      "stage": "routing",
      "prompt": "Compare this skill revision with the previous accepted one across discovery and task completion.",
      "expected_selection": "evaluate-agent-skill",
      "catalog_neighbors": ["author-agent-skill", "audit-agent-skill"],
      "assertions": ["The paraphrased regression request selects the target.", "The target recognizes both routing and activated execution without keyword mirroring."]
    },
    {
      "id": 8,
      "stage": "routing",
      "prompt": "Create evaluation cases and a grader for this Agent Skill.",
      "expected_selection": ["axm", "author-agent-skill"],
      "catalog_neighbors": ["axm", "author-agent-skill", "audit-agent-skill"],
      "assertions": ["The target abstains because the request authors evaluation source.", "AXM and the authoring neighbor remain eligible in execution order."]
    },
    {
      "id": 9,
      "stage": "routing",
      "prompt": "Audit this Agent Skill's security, provenance, and lifecycle conformity.",
      "expected_selection": "audit-agent-skill",
      "catalog_neighbors": ["audit-agent-skill", "author-agent-skill"],
      "assertions": ["The target abstains because the request is a conformity and trust audit.", "The audit neighbor remains eligible."]
    },
    {
      "id": 10,
      "stage": "routing",
      "prompt": "Evaluate whether this standalone system prompt improves response quality.",
      "expected_selection": "clarify-or-abstain",
      "catalog_neighbors": ["author-agent-skill", "audit-agent-skill"],
      "assertions": ["The target abstains because the artifact is not an Agent Skill.", "General evaluation vocabulary alone does not cause selection."]
    },
    {
      "id": 11,
      "stage": "routing",
      "prompt": "Can you check this skill?",
      "expected_selection": "clarify-or-abstain",
      "catalog_neighbors": ["author-agent-skill", "audit-agent-skill"],
      "assertions": ["The ambiguous request does not assume authoring, evaluation, or audit intent.", "The response clarifies the desired operation."]
    },
    {
      "id": 12,
      "stage": "routing",
      "prompt": "$evaluate-agent-skill execute the declared suite for this exact revision.",
      "expected_selection": "evaluate-agent-skill",
      "catalog_neighbors": ["author-agent-skill", "audit-agent-skill"],
      "assertions": ["Explicit invocation selects the target.", "The result is treated as a control rather than implicit-routing evidence."]
    },
    {
      "id": 13,
      "stage": "execution",
      "prompt": "Report the regression result for this run and state what it supports.",
      "expected_output": "Non-discriminating assertions and a weak assertion reported as suite findings, the self-reported workaround surfaced as a target gap, and no claim that the skill added value.",
      "files": ["evals/files/defective-suite.md"],
      "assertions": ["Assertions passing in both configurations are reported as non-discriminating rather than as evidence of skill value.", "The file-name assertion is identified as satisfiable by an output with wrong or empty contents.", "The uncovered outcome, file contents, is named as a gap in the suite.", "The workaround self-reported in trial 2 is surfaced as a target gap that the passing assertions did not catch.", "Suite findings are routed to authoring and the suite is not repaired during the run.", "The 100% pass rate is not reported as a supported comparative conclusion."]
    },
    {
      "id": 14,
      "stage": "execution",
      "prompt": "The candidate won six of six. Record this as regression evidence that the candidate is better.",
      "expected_output": "Lost blinding, pre-recorded attribution, and fixed presentation order identified as separate defects, with the preference claim withheld and rerun conditions named.",
      "files": ["evals/files/unblinded-comparison.md"],
      "assertions": ["Naming the candidate to the judge is identified as lost blinding that invalidates the preference claim.", "Attribution drafted before the verdict is identified as a separate defect rather than a reporting detail.", "Fixed presentation order is reported as an uncontrolled position effect.", "The six-of-six result is not recorded as regression evidence that the candidate is better.", "Required reruns name blinded judging with provenance withheld and varied presentation order."]
    },
    {
      "id": 15,
      "stage": "routing",
      "prompt": "we keep arguing about whether the new version of our deploy-checklist skill actually helps. can you set up a proper head to head and get me numbers i can trust",
      "expected_selection": "evaluate-agent-skill",
      "catalog_neighbors": ["author-agent-skill", "audit-agent-skill"],
      "assertions": ["The target is selected for a comparative behavioral run from a casually phrased request that never names evaluation.", "Selection occurs before the target body, fixture, or expected result is visible."]
    }
  ]
}
